data/raw/github/iree/17635/initial-capture/issue-995d00fefffd49bf82f6c6e24f9eb4c4d5f2942bce5da76516c0b8fc6db63539.json

{"url":"https://api.github.com/repos/iree-org/iree/issues/17635","repository_url":"https://api.github.com/repos/iree-org/iree","labels_url":"https://api.github.com/repos/iree-org/iree/issues/17635/labels{/name}","comments_url":"https://api.github.com/repos/iree-org/iree/issues/17635/comments","events_url":"https://api.github.com/repos/iree-org/iree/issues/17635/events","html_url":"https://github.com/iree-org/iree/issues/17635","id":2344961883,"node_id":"I_kwDODGgK6M6LxUdb","number":17635,"title":"Crash / ASan issues using VmModule.wrap_buffer from Python","user":{"login":"ScottTodd","id":4010439,"node_id":"MDQ6VXNlcjQwMTA0Mzk=","avatar_url":"https://avatars.githubusercontent.com/u/4010439?v=4","gravatar_id":"","url":"https://api.github.com/users/ScottTodd","html_url":"https://github.com/ScottTodd","followers_url":"https://api.github.com/users/ScottTodd/followers","following_url":"https://api.github.com/users/ScottTodd/following{/other_user}","gists_url":"https://api.github.com/users/ScottTodd/gists{/gist_id}","starred_url":"https://api.github.com/users/ScottTodd/starred{/owner}{/repo}","subscriptions_url":"https://api.github.com/users/ScottTodd/subscriptions","organizations_url":"https://api.github.com/users/ScottTodd/orgs","repos_url":"https://api.github.com/users/ScottTodd/repos","events_url":"https://api.github.com/users/ScottTodd/events{/privacy}","received_events_url":"https://api.github.com/users/ScottTodd/received_events","type":"User","user_view_type":"public","site_admin":false},"labels":[{"id":1553038945,"node_id":"MDU6TGFiZWwxNTUzMDM4OTQ1","url":"https://api.github.com/repos/iree-org/iree/labels/bug%20%F0%9F%90%9E","name":"bug 🐞","color":"d73a4a","default":false,"description":"Something isn't working","archived_at":null,"archived_by":null},{"id":2524353575,"node_id":"MDU6TGFiZWwyNTI0MzUzNTc1","url":"https://api.github.com/repos/iree-org/iree/labels/bindings/python","name":"bindings/python","color":"22ad75","default":false,"description":"Python wrapping IREE's C API","archived_at":null,"archived_by":null}],"state":"open","locked":false,"assignees":[{"login":"ScottTodd","id":4010439,"node_id":"MDQ6VXNlcjQwMTA0Mzk=","avatar_url":"https://avatars.githubusercontent.com/u/4010439?v=4","gravatar_id":"","url":"https://api.github.com/users/ScottTodd","html_url":"https://github.com/ScottTodd","followers_url":"https://api.github.com/users/ScottTodd/followers","following_url":"https://api.github.com/users/ScottTodd/following{/other_user}","gists_url":"https://api.github.com/users/ScottTodd/gists{/gist_id}","starred_url":"https://api.github.com/users/ScottTodd/starred{/owner}{/repo}","subscriptions_url":"https://api.github.com/users/ScottTodd/subscriptions","organizations_url":"https://api.github.com/users/ScottTodd/orgs","repos_url":"https://api.github.com/users/ScottTodd/repos","events_url":"https://api.github.com/users/ScottTodd/events{/privacy}","received_events_url":"https://api.github.com/users/ScottTodd/received_events","type":"User","user_view_type":"public","site_admin":false}],"milestone":null,"comments":48,"created_at":"2024-06-10T22:32:52Z","updated_at":"2025-02-05T20:08:19Z","closed_at":null,"assignee":{"login":"ScottTodd","id":4010439,"node_id":"MDQ6VXNlcjQwMTA0Mzk=","avatar_url":"https://avatars.githubusercontent.com/u/4010439?v=4","gravatar_id":"","url":"https://api.github.com/users/ScottTodd","html_url":"https://github.com/ScottTodd","followers_url":"https://api.github.com/users/ScottTodd/followers","following_url":"https://api.github.com/users/ScottTodd/following{/other_user}","gists_url":"https://api.github.com/users/ScottTodd/gists{/gist_id}","starred_url":"https://api.github.com/users/ScottTodd/starred{/owner}{/repo}","subscriptions_url":"https://api.github.com/users/ScottTodd/subscriptions","organizations_url":"https://api.github.com/users/ScottTodd/orgs","repos_url":"https://api.github.com/users/ScottTodd/repos","events_url":"https://api.github.com/users/ScottTodd/events{/privacy}","received_events_url":"https://api.github.com/users/ScottTodd/received_events","type":"User","user_view_type":"public","site_admin":false},"author_association":"MEMBER","issue_field_values":[],"type":null,"active_lock_reason":null,"sub_issues_summary":{"total":0,"completed":0,"percent_completed":0},"issue_dependencies_summary":{"blocked_by":0,"total_blocked_by":0,"blocking":0,"total_blocking":0},"body":"(Lots of red herrings here, see https://github.com/iree-org/iree/issues/17635#issuecomment-2163644331 for latest issue description)\r\n\r\n---\r\n\r\n\r\nSplitting off of https://github.com/llvm/torch-mlir/issues/3433 to discuss IREE-specific details.\r\n\r\nI wrote some test cases for https://pytorch.org/docs/stable/generated/torch.Tensor.index_put_.html starting from PyTorch and going through iree-turbine / torch-mlir to IREE: https://gist.github.com/ScottTodd/1e95795e79d17964078217ca98a3a398. Latest results:\r\n```\r\ntest_single_value                  | PASS\r\ntest_multiple_values               | PASS (then crash)\r\ntest_broadcast_value_along_axis    | FAIL\r\ntest_broadcast_value_along_indices | FAIL\r\ntest_broadcast_values_along_axis   | PASS (then crash)\r\n```\r\n\r\nThe two \"pass then crash\" test cases used to pass without crashing and I found some interesting results bisecting through IREE releases.\r\n\r\nrelease | test result\r\n-- | --\r\niree_compiler==20240514.893 | PASS --> CRASH\r\niree_compiler==20240508.887 |\r\niree_compiler==20240507.886 | Error invoking function ...\r\niree_compiler==20240506.885 |\r\niree_compiler==20240505.884 |\r\niree_compiler==20240504.883 |\r\niree_compiler==20240503.882 |\r\niree_compiler==20240502.881 |\r\niree_compiler==20240501.880 | Error invoking function ...\r\niree_compiler==20240430.879 |\r\niree_compiler==20240429.878 |\r\niree_compiler==20240428.877 |\r\niree_compiler==20240427.876 | Error invoking function ...\r\niree_compiler==20240426.875 |\r\niree_compiler==20240425.874 | Error invoking function ...\r\niree_compiler==20240424.873 | Error invoking function ...\r\niree_compiler==20240423.872 | PASS --> CRASH\r\niree_compiler==20240422.871 |\r\niree_compiler==20240421.870 |\r\niree_compiler==20240420.869 | PASS --> CRASH\r\niree_compiler==20240419.868 | PASS --> CRASH\r\niree_compiler==20240418.867 | PASS\r\niree_compiler==20240417.866 | PASS\r\niree_compiler==20240416.865 |\r\niree_compiler==20240415.864 |\r\niree_compiler==20240414.863 |\r\niree_compiler==20240412.861 |\r\niree_compiler==20240411.860 |\r\niree_compiler==20240410.859 | PASS\r\n\r\nCrash (during shutdown, maybe from writing out of bounds?):\r\n```\r\n======================================== 1 passed in 3.60s ======================================== Exception Code: 0xC0000005\r\n #0 0x00007ffa6c89a495 PyInit__runtime (D:\\dev\\projects\\SHARK-TestSuite\\iree_tests\\pytorch\\operators\\.venv\\Lib\\site-packages\\iree\\_runtime_libs\\_runtime.cp311-win_amd64.pyd+0x4a495)\r\n ...\r\n #5 0x00007ffa6c91bf1c nanobind::python_error::what(void) const (D:\\dev\\projects\\SHARK-TestSuite\\iree_tests\\pytorch\\operators\\.venv\\Lib\\site-packages\\iree\\_runtime_libs\\_runtime.cp311-win_amd64.pyd+0xcbf1c)\r\n```\r\n\r\n\"Error invoking function\" (fixed by https://github.com/iree-org/iree/pull/17339):\r\n```\r\n    def _invoke(self, arg_list, ret_list):\r\n>       self._vm_context.invoke(self._vm_function, arg_list, ret_list)\r\nE       ValueError: Error invoking function: D:\\a\\iree\\iree\\c\\runtime\\src\\iree\\hal\\command_buffer_validation.c:363: INVALID_ARGUMENT; source and target ranges overlap within the same buffer; while invoking native function hal.command_buffer.copy_buffer; while calling import;\r\nE       [ 2]   native hal.command_buffer.copy_buffer:0 -\r\nE       [ 1] bytecode module.main$async:526 d:\\dev\\projects\\SHARK-TestSuite\\iree_tests\\pytorch\\operators\\index_put_test.py:88:0\r\nE       [ 0] bytecode module.main:62 d:\\dev\\projects\\SHARK-TestSuite\\iree_tests\\pytorch\\operators\\index_put_test.py:88:0\r\n```\r\n\r\n## 20240418.867 to 20240419.868, pass --> crash\r\n\r\nBetween 20240418.867 and 20240419.868, the `test_multiple_values` test case started crashing.\r\n\r\nbefore: https://github.com/iree-org/iree/releases/tag/candidate-20240418.867\r\nafter: https://github.com/iree-org/iree/releases/tag/candidate-20240419.868\r\n\r\ndiff (https://github.com/iree-org/iree/compare/ff624dd8b27029f4d69f884a15ff3af8606b15b9...a2476ceef53f6d4ec0f7a9cf36892647626d324b):\r\n```\r\nλ git log --oneline candidate-20240418.867..candidate-20240419.868\r\na2476ceef5 [metal] Disable failing semaphore submission test until fixing (#17100)\r\n0e1e6bfe7a Clarify fusion heuristic (#17098)\r\n125f4200d8 [CodeGen] Add a pattern to fold extract_slice consumer into xfer.write. (#17067)\r\nf755b42289 [Codegen] Add folding in createBoundedTileSize for partially dynamic wgSize. (#17089)\r\na0b4853dc7 Fixes to enable out-of-tree plugin builds. (#17095)\r\nbd1b10626c [CodeGen] Drop encoding for HAL and Flow ops when DT is not supported. (#17081)\r\n886c4169ac [Winograd] Use TilingInterface for all levels of winograd op tiling (#17061)\r\n244195960f Add GPU dialect dependencies to C/Python bindings. (#17090)\r\nab4babee07 [ConstEval] Add flag to adjust tensor size limit for hoisting (#17064)\r\neec081c2c6 [LLVMGPU] Fallback if dynamic dim found on vector distribute. (#17085)\r\nf86f21cd80 [python] Expose MLIR python bindings for gpu and transform (#17088)\r\n4778f5f909 Categorize matmul/metvec like generic ops for dispatches (#17084)\r\nf32a87ccd2 [Flow] Move elementwise op fusion and bubble up expand shapes patterns into their own pass. (#17068)\r\n3677fbcce8 [runtime] Add semaphore test where 2 batches wait on a former batch amongst 2 (#17080)\r\n```\r\n\r\n### 20240423.872 to 20240424.873 crash --> error invoking function\r\n\r\nbefore: https://github.com/iree-org/iree/releases/tag/candidate-20240423.872\r\nafter: https://github.com/iree-org/iree/releases/tag/candidate-20240424.873\r\n\r\ndiff (https://github.com/iree-org/iree/compare/f5660ee72bd8e71910d00cec726375fb4b4a6de8...59532d30c0b8b3a0cdf261eaa4e69784c9fddeee):\r\n```\r\nλ git log --oneline candidate-20240423.872..candidate-20240424.873\r\n59532d30c0 Extend DecomposeConvolutionToLowerDimOpsPass (#17069)\r\n1b4c76f931 Adding a hoistable attr interface to allow attaching attrs to hoists. (#17139)\r\n729ebc642f [runtime][metal] exclude properly the failing semaphore test (#17151)\r\n30acc53257 [runtime][cts] add test where a device batch signals another and the host (#17138)\r\n94728e34c2 [LinalgExt][Winograd] Add winograd.filter_transform op (#17102)\r\n4bc90e7431 Run pytorch/models tests on AMDGPU with Vulkan. (#17129)\r\n330651efa6 [plugins][ROCM] Fix minor loc source resize bug (#17133)\r\nf7098e3f66 Moving regression suite to azure (#17140)\r\n290d812d96 [runtime][cts] add semaphore test where a batch waits on another and a host signal (#17130)\r\n8736479f5d Prevent stream.async.update folding unless confirmed safe. (#17135)\r\n7192e8c195 [Preprocessing] Add support for general ContractionOps and handle dynamic dimension using pad + expand. (#17123)\r\nd7db353adf Add initial website documentation for ONNX frontend. (#17004)\r\n568bb31780 [runtime][cts] Add test waiting on a semaphore for finite time and fix Vulkan driver (#17126)\r\n655b71a282 Executable library call hooks system, and a sample Linux/CPU event implementation (#15803)\r\n3dde925d11 [VectorDistribution] Add distribution pattern for vector::MultiDimReductionOp (#17076)\r\n```\r\n","closed_by":null,"reactions":{"url":"https://api.github.com/repos/iree-org/iree/issues/17635/reactions","total_count":0,"+1":0,"-1":0,"laugh":0,"hooray":0,"confused":0,"heart":0,"rocket":0,"eyes":0},"timeline_url":"https://api.github.com/repos/iree-org/iree/issues/17635/timeline","performed_via_github_app":null,"state_reason":null,"pinned_comment":null}

data/final/iree/17635/report.md

## Reported behavior

release | test result
-- | --
iree_compiler==20240514.893 | PASS --> CRASH
iree_compiler==20240508.887 |
iree_compiler==20240507.886 | Error invoking function ...
iree_compiler==20240506.885 |
iree_compiler==20240505.884 |
iree_compiler==20240504.883 |
iree_compiler==20240503.882 |
iree_compiler==20240502.881 |
iree_compiler==20240501.880 | Error invoking function ...
iree_compiler==20240430.879 |
iree_compiler==20240429.878 |
iree_compiler==20240428.877 |
iree_compiler==20240427.876 | Error invoking function ...
iree_compiler==20240426.875 |
iree_compiler==20240425.874 | Error invoking function ...
iree_compiler==20240424.873 | Error invoking function ...
iree_compiler==20240423.872 | PASS --> CRASH
iree_compiler==20240422.871 |
iree_compiler==20240421.870 |
iree_compiler==20240420.869 | PASS --> CRASH
iree_compiler==20240419.868 | PASS --> CRASH
iree_compiler==20240418.867 | PASS
iree_compiler==20240417.866 | PASS
iree_compiler==20240416.865 |
iree_compiler==20240415.864 |
iree_compiler==20240414.863 |
iree_compiler==20240412.861 |
iree_compiler==20240411.860 |
iree_compiler==20240410.859 | PASS

## 20240418.867 to 20240419.868, pass --> crash

Between 20240418.867 and 20240419.868, the `test_multiple_values` test case started crashing.

before: https://github.com/iree-org/iree/releases/tag/candidate-20240418.867
after: https://github.com/iree-org/iree/releases/tag/candidate-20240419.868

### 20240423.872 to 20240424.873 crash --> error invoking function

before: https://github.com/iree-org/iree/releases/tag/candidate-20240423.872
after: https://github.com/iree-org/iree/releases/tag/candidate-20240424.873